{
  "version": "1.4",
  "generated": "2026-08-13",
  "sources": [
    "03 Database Architecture/Legacy_Column_Flutter_Keep_Map.md",
    "03 Database Architecture/Belongity_Taxonomy_Migration_Wiki.md",
    "02a Belongity_Domain_Taxonomy_Entity_Html_Guides/Part25d_Legacy_Master_Registry_wiki.html",
    "03 Database Architecture/MySql Migration Scripts/bc_entity_constants.py",
    "CoWork Projects/Founders Future Prompts/Taxo_FK_Contract_Build_Spec.md v2 (founder-approved starter table)",
    "live taxo.master @ sandbox (existence-check + drift re-check only, 2026-07-20)",
    "CoWork Projects/Founders Future Prompts/Add Rules to Git/SPEC_Taxo_IdSpace_And_Tenant_Scope_Gates.md (founder-approved; G2 entries added 2026-08-13, hierarchy_level for org_purpose_category_idfr/org_mission_category_idfr corrected from spec's 'domain' to 'leaf' per live-code cross-check; org_goal_category_idfr deliberately excluded pending founder clarification)",
    "External critic follow-up on .github#32 (2026-08-13, this PR): the merged contract's hierarchy_level='leaf' for org_purpose_category_idfr / org_mission_category_idfr was sourced from explore-organization.sql.ts and discover.sql.v1.ts's read-JOIN predicates -- the exact predicates PR #1130 (service_orbit_orgs, merged 25 minutes after #32) removed on the finding that 'leaf' was WRONG there. Corrected to 'domain' per the live write/validate reference paths (org_purpus_category.sql.ts:addPredefinedPurposeCategory, org_mission_category.validator.ts:validateMissionCetegoryId), which reject any id that is not hierarchy_level='domain'. checker.py also fixed: _closest() was block-scoped only, so a level literal from a NEIGHBOURING join in the same backtick block (e.g. a size/type join) could be misattributed to a column with no level literal of its own -- narrowed to the single JOIN...ON clause.",
    "CoWork Projects/Founders Future Prompts/Add Rules to Git/SPEC_Taxo_IdSpace_And_Tenant_Scope_Gates.md (founder-approved; G3 2026-08-13, added is_active_exempt allowlist, starts empty; rebased on #34's domain-level correction)",
    "External critic triage of service_orbit_orgs#1132 findings (this PR): 47/66 rule-2.6 violations are all under src/api-admin/**, all admin CRUD, collapsed into one glob exemption rather than 47 individual entries."
  ],
  "columns": {
    "influencer_domain_idfr": {
      "entity_table": "meta.influencers",
      "taxo_type": "infl_domain",
      "hierarchy_level": "domain",
      "concept": "influencer field of activity (domain level)",
      "source": "Taxo_FK_Contract_Build_Spec.md §Starter entries (founder-approved 2026-07-17); KeepMap L83/117; Belongity_Taxonomy_Migration_Wiki.md",
      "data_status": "ok"
    },
    "influencer_category_idfr": {
      "entity_table": "meta.influencers",
      "taxo_type": "infl_domain",
      "hierarchy_level": "category",
      "concept": "influencer field of activity (category level)",
      "source": "Taxo_FK_Contract_Build_Spec.md §Starter entries (founder-approved 2026-07-17); KeepMap L83/117; Belongity_Taxonomy_Migration_Wiki.md",
      "data_status": "null_pre_launch"
    },
    "influencer_sub_domain_idfr": {
      "entity_table": "meta.influencers",
      "taxo_type": "infl_domain",
      "hierarchy_level": "leaf",
      "concept": "influencer field of activity (sub-domain/leaf level)",
      "source": "Taxo_FK_Contract_Build_Spec.md §Starter entries (founder-approved 2026-07-17); KeepMap L83/117; Belongity_Taxonomy_Migration_Wiki.md",
      "data_status": "null_pre_launch"
    },
    "infl_type_idfr": {
      "entity_table": "meta.influencers",
      "taxo_type": "infl_type",
      "hierarchy_level": "leaf",
      "concept": "influencer type",
      "source": "Taxo_FK_Contract_Build_Spec.md §Starter entries (founder-approved 2026-07-17); KeepMap L83/117; Belongity_Taxonomy_Migration_Wiki.md",
      "data_status": "ok"
    },
    "org_department_idfr": {
      "entity_table": "org_n.org_member_department",
      "taxo_type": "o_department",
      "hierarchy_level": "leaf",
      "concept": "organization department",
      "source": "Taxo_FK_Contract_Build_Spec.md §Starter entries (founder-approved 2026-07-17); KeepMap L83/117; Belongity_Taxonomy_Migration_Wiki.md",
      "data_status": "ok"
    },
    "o_project_type_idfr": {
      "entity_table": "taxonomy dropdown / admin-endpoint (no single entity column — param-keyed lookup)",
      "taxo_type": "o_project_type",
      "hierarchy_level": "leaf",
      "concept": "organization project type",
      "source": "Taxo_FK_Contract_Build_Spec.md §Starter entries (founder-approved 2026-07-17); KeepMap L83/117; Belongity_Taxonomy_Migration_Wiki.md",
      "data_status": "ok"
    },
    "o_user_type_idfr": {
      "entity_table": "taxonomy dropdown / admin-endpoint (no single entity column — param-keyed lookup)",
      "taxo_type": "o_user_type",
      "hierarchy_level": "leaf",
      "concept": "organization user type",
      "source": "Taxo_FK_Contract_Build_Spec.md §Starter entries (founder-approved 2026-07-17); KeepMap L83/117; Belongity_Taxonomy_Migration_Wiki.md",
      "data_status": "ok"
    },
    "o_user_tag_idfr": {
      "entity_table": "taxonomy dropdown / admin-endpoint (no single entity column — param-keyed lookup)",
      "taxo_type": "o_user_tag",
      "hierarchy_level": "leaf",
      "concept": "organization user tag",
      "source": "Taxo_FK_Contract_Build_Spec.md §Starter entries (founder-approved 2026-07-17); KeepMap L83/117; Belongity_Taxonomy_Migration_Wiki.md",
      "data_status": "ok"
    },
    "o_management_level_idfr": {
      "entity_table": "taxonomy dropdown / admin-endpoint (no single entity column — param-keyed lookup)",
      "taxo_type": "o_management_level",
      "hierarchy_level": "leaf",
      "concept": "organization management level",
      "source": "Taxo_FK_Contract_Build_Spec.md §Starter entries (founder-approved 2026-07-17); KeepMap L83/117; Belongity_Taxonomy_Migration_Wiki.md",
      "data_status": "ok"
    },
    "location_country_idfr": {
      "entity_table": "taxonomy dropdown / admin-endpoint (no single entity column — param-keyed lookup)",
      "taxo_type": "location_country",
      "hierarchy_level": "leaf",
      "concept": "country (location taxonomy)",
      "source": "Taxo_FK_Contract_Build_Spec.md §Starter entries (founder-approved 2026-07-17); KeepMap L83/117; Belongity_Taxonomy_Migration_Wiki.md",
      "data_status": "ok"
    },
    "infl_title_idfr": {
      "entity_table": "meta.influencers",
      "taxo_type": "infl_title",
      "hierarchy_level": "leaf",
      "concept": "influencer title",
      "source": "Taxo_FK_Contract_Build_Spec.md §Starter entries (founder-approved 2026-07-17); KeepMap L83/117; Belongity_Taxonomy_Migration_Wiki.md",
      "data_status": "ok"
    },
    "o_task_type_idfr": {
      "entity_table": "taxonomy dropdown / admin-endpoint (no single entity column — param-keyed lookup)",
      "taxo_type": "o_task_type",
      "hierarchy_level": "domain",
      "concept": "organization task type (domain level)",
      "source": "Taxo_FK_Contract_Build_Spec.md §Starter entries (founder-approved 2026-07-17); KeepMap L83/117; Belongity_Taxonomy_Migration_Wiki.md",
      "data_status": "ok"
    },
    "o_task_sub_type_idfr": {
      "entity_table": "taxonomy dropdown / admin-endpoint (no single entity column — param-keyed lookup)",
      "taxo_type": "o_task_type",
      "hierarchy_level": "category",
      "concept": "organization task sub-type (category level)",
      "source": "Taxo_FK_Contract_Build_Spec.md §Starter entries (founder-approved 2026-07-17); KeepMap L83/117; Belongity_Taxonomy_Migration_Wiki.md",
      "data_status": "ok"
    },
    "social_topic_idfr": {
      "entity_table": "org_n.org_social_topic",
      "taxo_type": "social_topic_master",
      "hierarchy_level": "domain",
      "concept": "social topic (domain level)",
      "source": "Taxo_FK_Contract_Build_Spec.md §Starter entries (founder-approved 2026-07-17); KeepMap L83/117; Belongity_Taxonomy_Migration_Wiki.md",
      "data_status": "ok"
    },
    "social_sub_topic_idfr": {
      "entity_table": "org_n.org_social_sub_topic",
      "taxo_type": "social_topic_master",
      "hierarchy_level": "leaf",
      "concept": "social sub-topic (leaf level)",
      "source": "Taxo_FK_Contract_Build_Spec.md §Starter entries (founder-approved 2026-07-17); KeepMap L83/117; Belongity_Taxonomy_Migration_Wiki.md",
      "data_status": "ok"
    },
    "o_broadcast_section_idfr": {
      "entity_table": "taxonomy dropdown / admin-endpoint (no single entity column — param-keyed lookup)",
      "taxo_type": "o_broadcast_section",
      "hierarchy_level": "domain",
      "concept": "org broadcast section (domain level)",
      "source": "Taxo_FK_Contract_Build_Spec.md §Starter entries (founder-approved 2026-07-17); KeepMap L83/117; Belongity_Taxonomy_Migration_Wiki.md",
      "data_status": "ok"
    },
    "o_broadcast_sub_section_idfr": {
      "entity_table": "taxonomy dropdown / admin-endpoint (no single entity column — param-keyed lookup)",
      "taxo_type": "o_broadcast_section",
      "hierarchy_level": "leaf",
      "concept": "org broadcast sub-section (leaf level)",
      "source": "Taxo_FK_Contract_Build_Spec.md §Starter entries (founder-approved 2026-07-17); KeepMap L83/117; Belongity_Taxonomy_Migration_Wiki.md",
      "data_status": "ok"
    },
    "prf_skill_category_idfr": {
      "entity_table": "taxonomy dropdown / admin-endpoint (no single entity column — param-keyed lookup)",
      "taxo_type": "prf_skill",
      "hierarchy_level": "domain",
      "concept": "profile skill category (domain level)",
      "source": "Taxo_FK_Contract_Build_Spec.md §Starter entries (founder-approved 2026-07-17); KeepMap L83/117; Belongity_Taxonomy_Migration_Wiki.md",
      "data_status": "ok"
    },
    "match_goals_p_idfr": {
      "entity_table": "meta.organization | meta.influencers | meta.lineage | purpus_user.user",